{
  "model_config": {
    "name": "lotka_volterra_2d",
    "dimension": 2,
    "true_parameters": [1.2, 0.8]
  },
  "numerical_params": {
    "GN": 10,
    "degree_range": [3, 8],
    "basis": "chebyshev",
    "precision": "Float64Precision"
  },
  "domain_config": {
    "ranges": [0.5, 0.5],
    "center_offset_strategy": "random_sphere",
    "offset_magnitude": 0.1
  },
  "tracking": {
    "gitlab_enabled": true,
    "campaign_name": "2D_LV_Convergence_Study",
    "auto_create_issue": false
  }
}
